xxxx;;;;;;;;;;;;;;x
UNITY_IS_ATLEAST_TRIGGER;国家凝聚力至少 Y$VALUE$W。\n;L'unit?est au moins ?Y$VALUE$W。\n;Zusammenhalt steht bei mindestens Y$VALUE$W。\n;;La unidad est?al menos a Y$VALUE$W。\n;;;;;;;;;x
AMOUNT_OF_DIVISIONS_IS_ATLEAST_TRIGGER;Y$COUNTRY$W 至少有 Y$VALUE$W个师W。\n;Le nombre de divisions de Y$COUNTRY$W est au moins de Y$VALUE$W。\n;Anzahl der Divisionen in Y$COUNTRY$W steht bei mindestens Y$VALUE$W。\n;;El nmero de divisiones de Y$COUNTRY$W es al menos Y$VALUE$W。\n;;;;;;;;;x
IDEOLOGY_IS_EQUAL_TO_TRIGGER;执政党是 Y$NAME$W。\n;L'idologie de Y$COUNTRY$W quivaut ?celle de Y$NAME$W。\n;Ideologie in Y$COUNTRY$W ist quivalent mit Y$NAME$W。\n;;La ideologa de Y$COUNTRY$W es igual a la de Y$NAME$W。\n;;;;;;;;;x
MINISTER_ALIVE_TRIGGER;Y$NAME$W 依然可用W。\n;Y$NAME$W est vivantW。\n;Y$NAME$W lebtW。\n;;Y$NAME$W est?con vidaW。\n;;;;;;;;;x
MONEY_IS_ATLEAST_TRIGGER;现金数目至少有 Y$VALUE$W。\n;Il y a au moins Y$VALUE$W d'argent。\n;Geld steht bei mindestens Y$VALUE$W。\n;;El dinero es un mnimo de Y$VALUE$W。\n;;;;;;;;;x
THREAT_IS_ATLEAST_WITH_TRIGGER;Y$COUNTRY$W 与 Y$TARGET_COUNTRY$W 的条约至少还有 Y$VALUE$W。\n;La menace de Y$COUNTRY$W ?l'encontre de Y$TARGET_COUNTRY$W est d'au moins Y$VALUE$W。\n;Die Bedrohung von Y$TARGET_COUNTRY$W durch Y$COUNTRY$W steht bei mindestens Y$VALUE$W。\n;;La amenaza de Y$COUNTRY$W a Y$TARGET_COUNTRY$W es al menos de Y$VALUE$W。\n;;;;;;;;;x
ENERGY_IS_ATLEAST_TRIGGER;能源至少有 Y$VALUE$W。\n;Il y a au moins Y$VALUE$W d'nergie。\n;Energie steht bei mindestens Y$VALUE$W。\n;;La energa est?al menos a Y$VALUE$W。\n;;;;;;;;;x
CRUDE_OIL_IS_ATLEAST_TRIGGER;原油至少有 Y$VALUE$W。\n;Il y a au moins Y$VALUE$W de ptrole brut。\n;Rohl steht bei mindestens Y$VALUE$W。\n;;El crudo est?al menos a Y$VALUE$W。\n;;;;;;;;;x
RARE_MATERIALS_IS_ATLEAST_TRIGGER;稀有原料至少有 Y$VALUE$W。\n;Il y a au moins Y$VALUE$W de matriaux rares。\n;Seltene Materialien steht bei mindestens Y$VALUE$W。\n;;los materiales raros estn al menos a Y$VALUE$W。\n;;;;;;;;;x
METAL_IS_ATLEAST_TRIGGER;金属至少有 Y$VALUE$W。\n;Il y a au moins Y$VALUE$W de mtaux。\n;Metalle steht bei mindestens Y$VALUE$W。\n;;El metal est?al menos a Y$VALUE$W。\n;;;;;;;;;x
SUPPLIES_IS_ATLEAST_TRIGGER;补给品至少有Y$VALUE$W。\n;Il y a au moins Y$VALUE$W de ravitaillement。\n;Nachschub steht bei mindestens Y$VALUE$W。\n;;Los suministros estn al menos a Y$VALUE$W。\n;;;;;;;;;x
MILITARY_ACCESS_WITH_TRIGGER;Y$COUNTRY$W 拥有 Y$TARGET_COUNTRY$W的通行权W。\n;Y$COUNTRY$W dispose d'un accs militaire au pays : Y$TARGET_COUNTRY$W。\n;Y$COUNTRY$W hat Militrzugang zu Y$TARGET_COUNTRY$W。\n;;Y$COUNTRY$W tiene acceso militar a Y$TARGET_COUNTRY$W。\n;;;;;;;;;x
NON_AGGRESSION_PACT_WITH_TRIGGER;Y$COUNTRY$W 和 Y$TARGET_COUNTRY$W之间有互不侵犯条约W。\n;Y$COUNTRY$W a sign?un pacte de non agression avec Y$TARGET_COUNTRY$W。\n;Y$COUNTRY$W hat Nichtangriffspakt mit Y$TARGET_COUNTRY$W。\n;;Y$COUNTRY$W tiene un pacto de no agresin con Y$TARGET_COUNTRY$W。\n;;;;;;;;;x
LOST_NATIONAL_PROVINCES_ATLEAST_TRIGGER;Y$COUNTRY$W 至少失去了 Y$VALUE$%W 个国家省份W。\n;Y$COUNTRY$W a perdu au moins Y$VALUE$%W provinces nationales W。\n;Y$COUNTRY$W verloren mindestens Y$VALUE$%W Provinzen W。\n;;Y$COUNTRY$W ha perdido Y$VALUE$%W provincias nacionales W。\n;;;;;;;;;x
LOST_IC_IS_ATLEAST_TRIGGER;Y$COUNTRY$W 至少失去了 Y$VALUE$%W IC W。\n;Y$COUNTRY$W a perdu au moins Y$VALUE$%W en CI W。\n;Y$COUNTRY$W verloren mindestens Y$VALUE$%W IC W。\n;;Y$COUNTRY$W ha perdido Y$VALUE$%W CI W。\n;;;;;;;;;x
GOVERNMENT_POSITION_TRIGGER;Y$NAME$W 是 Y$POSITION$W。\n;Y$NAME$W est Y$POSITION$W。\n;Y$NAME$W ist Y$POSITION$W。\n;;Y$NAME$W es Y$POSITION$W。\n;;;;;;;;;x
GOVERNMENT_POSITION_NOT_TRIGGER;Y$NAME$W 不是 Y$POSITION$W。\n;Y$NAME$W n'est pas Y$POSITION$W。\n;Y$NAME$W ist nicht Y$POSITION$W。\n;;Y$NAME$W no es Y$POSITION$W。\n;;;;;;;;;x
IS_GUARANTEEING_TRIGGER;Y$COUNTRY$W 对 Y$TARGET_COUNTRY$W独立保障W。\n;Y$COUNTRY$W garantit Y$TARGET_COUNTRY$W。\n;Y$COUNTRY$W gibt Garantie aus fr Y$TARGET_COUNTRY$W。\n;;Y$COUNTRY$W garantiza a Y$TARGET_COUNTRY$W。\n;;;;;;;;;x
DISSENT_IS_ATLEAST_TRIGGER;异议度至少有 Y$VALUE$W。\n;La dissidence est au moins de Y$VALUE$W。\n;Unmut steht bei mindestens Y$VALUE$W。\n;;La disensin est?al menos a Y$VALUE$W。\n;;;;;;;;;x
ORGANISATION_IS_ATLEAST_TRIGGER;Y$IDEOLOGY$W 至少有 Y$VALUE$W 在该组织中W。\n;Y$IDEOLOGY$W a un impact d'au moins Y$VALUE$W sur l'organisationW。\n;Der Organisationswert von Y$IDEOLOGY$W steht bei mindestens Y$VALUE$W W。\n;;Y$IDEOLOGY$W tiene un mnimo de Y$VALUE$W en organizacinW。\n;;;;;;;;;x
POPULARITY_IS_ATLEAST_TRIGGER;Y$IDEOLOGY$W 的支持率至少是 Y$VALUE$W。\n;La popularit?de Y$IDEOLOGY$W est d'au moins Y$VALUE$W。\n;Die Beliebtheit von Y$IDEOLOGY$W ist mindestens Y$VALUE$W。\n;;Y$IDEOLOGY$W tiene una popularidad mnima de Y$VALUE$W。\n;;;;;;;;;x
IS_THREATEND_TRIGGER;Y$COUNTRY$W 受到了的警告，为期 Y$VALUE$W。\n;Y$COUNTRY$W est menac?par certains pays et la valeur de la menace est d'au moins Y$VALUE$W。\n;Y$COUNTRY$W wird von Lndern mit einem Bedrohungswert von mindestens Y$VALUE$W bedroht。\n;;Y$COUNTRY$W est?amenazado por pases con un valor de amenaza de al menos Y$VALUE$W。\n;;;;;;;;;x
THREAT_IS_NOT_TRIGGER;Y$COUNTRY$W 对 Y$TARGET_COUNTRY$W 的威胁不是 Y$VALUE$W。\n;La menace de Y$COUNTRY$W ?l'encontre de Y$TARGET_COUNTRY$W n'est pas de niveau Y$VALUE$W。\n;Y$COUNTRY$W Bedrohung von Y$TARGET_COUNTRY$W ist nicht Y$VALUE$W。\n;;La amenaza de Y$COUNTRY$W a Y$TARGET_COUNTRY$W no es Y$VALUE$W。\n;;;;;;;;;x
UNITY_IS_NOT_TRIGGER;国家凝聚力不足 Y$VALUE$W。\n;L'unit?n'est pas de niveau Y$VALUE$W。\n;Zusammenhalt ist nicht Y$VALUE$W。\n;;La unidad no es Y$VALUE$W。\n;;;;;;;;;x
AMOUNT_OF_DIVISIONS_IS_NOT_TRIGGER;Y$COUNTRY$W 的陆军师数量不是 Y$VALUE$W。\n;Le nombre de divisions de Y$COUNTRY$W n'est pas de Y$VALUE$W。\n;Y$COUNTRY$W Anzahl der Divisionen ist nicht Y$VALUE$W。\n;;El nmero de divisiones de Y$COUNTRY$W no es Y$VALUE$W。\n;;;;;;;;;x
IDEOLOGY_IS_NOT_TRIGGER;执政党不是 Y$NAME$W。\n;L'idologie de Y$COUNTRY$W n'quivaut pas ?celle de Y$NAME$W。\n;Y$COUNTRY$Ws Ideologie ist nicht quivalent zu Y$NAME$W。\n;;La ideologa de Y$COUNTRY$W no es igual a la de Y$NAME$W。\n;;;;;;;;;x
MINISTER_IS_NOT_ALIVE_TRIGGER;Y$NAME$W 已经去世了W。\n;Y$NAME$W est mortW。\n;Y$NAME$W ist totW。\n;;Y$NAME$W no est?con vidaW。\n;;;;;;;;;x
MONEY_IS_NOT_TRIGGER;现金数量不是 Y$VALUE$W。\n;L'argent disponible n'est pas de Y$VALUE$W。\n;Geld ist nicht Y$VALUE$W。\n;;El dinero no es Y$VALUE$W。\n;;;;;;;;;x
ENERGY_IS_NOT_TRIGGER;能源数量不是 Y$VALUE$W。\n;L'nergie disponible n'est pas de Y$VALUE$W。\n;Energie ist nicht Y$VALUE$W。\n;;La energa no es Y$VALUE$W。\n;;;;;;;;;x
CRUDE_OIL_IS_NOT_TRIGGER;原油数量不是 Y$VALUE$W。\n;Le stock de ptrole brut n'est pas de Y$VALUE$W。\n;Rohl ist nicht Y$VALUE$W。\n;;El crudo no es Y$VALUE$W。\n;;;;;;;;;x
RARE_MATERIALS_IS_NOT_TRIGGER;稀有原料数量不是 Y$VALUE$W。\n;Le stock de matriaux rares n'est pas de Y$VALUE$W。\n;Seltene Materialien ist nicht Y$VALUE$W。\n;;Los materiales raros no son Y$VALUE$W。\n;;;;;;;;;x
METAL_IS_NOT_TRIGGER;金属数量不是 Y$VALUE$W。\n;Le stock de mtaux n'est pas de Y$VALUE$W。\n;Metalle ist nicht Y$VALUE$W。\n;;El metal no es Y$VALUE$W。\n;;;;;;;;;x
SUPPLIES_IS_NOT_TRIGGER;补给品数量不是 Y$VALUE$W。\n;Le stock de ravitaillement n'est pas de Y$VALUE$W。\n;Nachschub ist nicht Y$VALUE$W。\n;;Los suministros no son Y$VALUE$W。\n;;;;;;;;;x
NO_NON_AGGRESSION_PACT_WITH;Y$COUNTRY$W 与 Y$TARGET_COUNTRY$W之间没有互不侵犯条约W。\n;Y$COUNTRY$W n'a pas sign?de pacte de non agression avec Y$TARGET_COUNTRY$W。\n;Y$COUNTRY$W hat keinen Nichtangriffspakt mit Y$TARGET_COUNTRY$W。\n;;Y$COUNTRY$W no tiene un pacto de no agresin con Y$TARGET_COUNTRY$W。\n;;;;;;;;;x
NO_MILITARY_ACCESS_WITH_TRIGGER;Y$COUNTRY$W 没有 Y$TARGET_COUNTRY$W领土的军事通行权W。\n;Y$COUNTRY$W ne dispose pas d'un accs militaire au pays Y$TARGET_COUNTRY$W。\n;Y$COUNTRY$W hat keinen Militrzugang zu Y$TARGET_COUNTRY$W。\n;;Y$COUNTRY$W no tiene acceso militar a Y$TARGET_COUNTRY$W。\n;;;;;;;;;x
LOST_NATIONAL_PROVINCES_NOT_TRIGGER;Y$COUNTRY$W 没有丢失 Y$VALUE$%W 国家省份W。\n;Y$COUNTRY$W n'a pas perdu Y$VALUE$%W provinces nationales W。\n;Y$COUNTRY$W hat keine Y$VALUE$%W Provinzen verloren W。\n;;Y$COUNTRY$W no ha perdido Y$VALUE$%W provincias nacionales W。\n;;;;;;;;;x
LOST_IC_IS_NOT_TRIGGER;Y$COUNTRY$W 没失去 Y$VALUE$%W IC W。\n;Y$COUNTRY$W n'a pas perdu Y$VALUE$%W en IC W。\n;Y$COUNTRY$W hat nicht Y$VALUE$%W IC W verloren。\n;;Y$COUNTRY$W no ha perdido Y$VALUE$%W CI W。\n;;;;;;;;;x
DISSENT_IS_NOT_TRIGGER;异议度不是 Y$VALUE$W。\n;La dissidence n'est pas de Y$VALUE$W。\n;Unmut ist nicht Y$VALUE$W。\n;;La disensin no es Y$VALUE$W。\n;;;;;;;;;x
ORGANISATION_IS_NOT_TRIGGER;Y$IDEOLOGY$W 在该组织中没有达到 Y$VALUE$W 。\n;L'impact de Y$IDEOLOGY$W sur l'organisation n'a pas t?de Y$VALUE$WW。\n;Der Organisationswert von Y$IDEOLOGY$W steht nicht bei Y$VALUE$W W。\n;;Y$IDEOLOGY$W no tiene Y$VALUE$W en organizacinW。\n;;;;;;;;;x
POPULARITY_IS_NOT_TRIGGER;Y$IDEOLOGY$W 普及度没有达到 Y$VALUE$W 。\n;La popularit?de Y$IDEOLOGY$W n'a pas t?de Y$VALUE$WW。\n;Der Beliebtheitswert von Y$IDEOLOGY$W steht nicht beiW。\n;;Y$IDEOLOGY$W no tiene Y$VALUE$W en popularidadW。\n;;;;;;;;;x
IS_NOT_THREATEND_TRIGGER;Y$COUNTRY$W 没有受到为期 Y$VALUE$W的警告W。\n;Y$COUNTRY$W n'est pas menac?par les pays dont la valeur de la menace est de Y$VALUE$W。\n;Y$COUNTRY$W wird nicht von Lndern mit dem Bedrohungswert Y$VALUE$W bedroht。\n;;Y$COUNTRY$W no est?amenazado por pases con un valor de amenaza de al menos Y$VALUE$W。\n;;;;;;;;;x
IS_NOT_GUARANTEEING_TRIGGER;Y$COUNTRY$W 没有对 Y$TARGET_COUNTRY$W进行独立保障W。\n;Y$COUNTRY$W ne protge pas Y$TARGET_COUNTRY$W。\n;Y$COUNTRY$W gibt keine Garantie aus frY$TARGET_COUNTRY$W。\n;;Y$COUNTRY$W no garantiza a Y$TARGET_COUNTRY$W。\n;;;;;;;;;x
COUNTRY_HAS_UNITS_IN_PROVINCE_TRIGGER;Y$COUNTRY$W 在 Y$PROVINCE$W拥有单位W。\n;Y$COUNTRY$W a des units dans la province Y$PROVINCE$W。\n;Y$COUNTRY$W hat Einheiten in der Provinz Y$PROVINCE$W。\n;;Y$COUNTRY$W tiene unidades en la provincia Y$PROVINCE$W。\n;;;;;;;;;x
COUNTRY_HAS_NO_UNITS_IN_PROVINCE_TRIGGER;Y$COUNTRY$W 在 Y$PROVINCE$W没有单位W。\n;Y$COUNTRY$W n'a pas d'units dans la province Y$PROVINCE$W。\n;Y$COUNTRY$W hat keine Einheiten in der Provinz Y$PROVINCE$W。\n;;Y$COUNTRY$W no tiene unidades en la provincia Y$PROVINCE$W。\n;;;;;;;;;x
ALL_ORG_POP_IS_NOT_TRIGGER;Y$IDEOLOGY$W并未拥有Y$ORGANISATION$W组织度和Y$POPULARITY$W支持率。\n;L'impact de Y$IDEOLOGY$W n'est pas de Y$ORGANISATION$W sur l'organisation et de Y$POPULARITY$W sur la popularit椐W。\n;Y$IDEOLOGY$W hat keinen Organisationswert von Y$ORGANISATION$W und keinen Beliebtheitswert von Y$POPULARITY$W W。\n;;Y$IDEOLOGY$W no tiene Y$ORGANISATION$W en organizacin y Y$POPULARITY$W en popularidadW。\n;;;;;;;;;x
ALL_ORG_POP_IS_ATLEAST_TRIGGER;Y$IDEOLOGY$W拥有至少Y$ORGANISATION$W组织度或Y$POPULARITY$W以上的支持率。\n;L'impact de Y$IDEOLOGY$W sur l'organisation est d'au moins Y$ORGANISATION$W ou l'impact de cette idologie sur la popularit?est suprieur ?Y$POPULARITY$W。\n;Y$IDEOLOGY$W hat einen Organisationswert von mindestens Y$ORGANISATION$W oder einen Beliebtheitswert von ber Y$POPULARITY$W。\n;;Y$IDEOLOGY$W tiene una organizacin de al menos Y$ORGANISATION$W o popularidad superior a Y$POPULARITY$W。\n;;;;;;;;;x
IS_NOT_LAW_TRIGGER;Y$LAW$W 不是 $GROUP$。\n;Y$LAW$W n'est PAS $GROUP$.;Y$LAW$W ist nicht $GROUP$.;;Y$LAW$W NO es el $GROUP$.;;;;;;;;;x
IS_LAW_TRIGGER; $GROUP$ 是 Y$LAW$W。\n;$GROUP$ est Y$LAW$W.;$GROUP$ ist Y$LAW$W.;;El $GROUP$ es Y$LAW$W.;;;;;;;;;x
IS_IN_EXILE;是一个流亡政府。\n;est un gouvernement en exil.;ist eine Exilregierung.;;es un gobierno en el exilio.;;;;;;;;;x
IS_NOT_IN_EXILE;不是一个流亡政府。\n;n'est PAS un gouvernement en exil.;ist KEINE Exilregierung.;;NO es un gobierno en el exilio.;;;;;;;;;x
NEUTRALITY_IS_NOT_TRIGGER;中立性是 Y$VALUE$W。\n;La neutralit?est infrieure ?Y$VALUE$W.;Neutralitt liegt unter Y$VALUE$W.;;La neutralidad es inferior a Y$VALUE$W.;;;;;;;;;x
NEUTRALITY_IS_ATLEAST_TRIGGER;中立性至少 Y$VALUE$W。\n;La neutralit?est au moins de Y$VALUE$W.;Neutralitt steht bei mindestens Y$VALUE$W.;;La neutralidad es al menos Y$VALUE$W.;;;;;;;;;x
IS_NOT_IN_FACTION_TRIGGER;不是任何阵营的成员。\n;n'est pas membre d'une faction.;Ist kein Mitglied einer Fraktion.;;No pertenece a ninguna faccin.;;;;;;;;;x
IS_IN_FACTION_TRIGGER;是某个阵营的成员。\n;est membre d'une faction.;Ist ein Mitglied einer Fraktion.;;Pertenece a una faccin.;;;;;;;;;x
IS_NUM_IN_FACTION_TRIGGER;是一个参与国家超过Y$VAL$W的阵营的成员。\n;est membre d'une faction d'au moins Y$VAL$W membres.;Ist ein Mitglied einer Fraktion mit mindestens Y$VAL$W Mitgliedern.;;Es un miembro de una faccin de al menos Y$VAL$W miembros.;;;;;;;;;x
IS_BELOW_NUM_IN_FACTION_TRIGGER;是一个参与国家少于Y$VAL$W的阵营的成员。\n;est membre d'une faction comportant moins de Y$VAL$W membres.;Ist ein Mitglied einer Fraktion mit weniger als Y$VAL$W Mitgliedern.;;Es un miembro de una faccin con menos de Y$VAL$W miembros.;;;;;;;;;x
IS_NOT_MEMBER_OF_FACTION_TRIGGER;不是 Y$FACTION$W的成员。\n;n'est PAS membre de Y$FACTION$W.;Ist KEIN Mitglied von Y$FACTION$W.;;NO es miembro de Y$FACTION$W.;;;;;;;;;x
IS_MEMBER_OF_FACTION_TRIGGER;是 Y$FACTION$W的成员。\n;est membre de Y$FACTION$W.;Ist ein Mitglied von Y$FACTION$W.;;Es miembro de Y$FACTION$W. ;;;;;;;;;x
